{
  "$schema": "https://branding.nvf.life/brand-kit.schema.json",
  "schema_version": "2.0.0",
  "version": "2026.08.3",
  "base_url": "https://branding.nvf.life",
  "updated": "2026-08-24",

  "brand": {
    "name": "New Vision Fellowship",
    "short_name": "New Vision",
    "abbreviation": "NVF",
    "website": "https://nvf.life",
    "mission": "To multiply God's glory on the earth.",
    "vision": "Multitudes shaped and sent for Christ.",
    "founded": 1997,
    "denomination": "Southern Baptist Convention",
    "affiliations": [
      "Southern Baptist Convention",
      "NC Baptists",
      "Triad Church Network"
    ]
  },

  "locations": [
    {
      "type": "campus",
      "street": "1135 West Academy Street",
      "city": "Madison",
      "state": "NC",
      "country": "USA",
      "email": "info@nvf.life",
      "phone": "336.427.6264"
    }
  ],

  "core_values": [
    "Jesus takes center stage",
    "God's Word grounds us",
    "Grace and truth are not rivals",
    "The gospel transforms how we live",
    "People matter to God and to us"
  ],

  "frameworks": {
    "on_ramps": {
      "description": "The four on-ramps to a fuller faith, drawn from Acts 2:41-47. Present in this order.",
      "order": ["gather", "give", "group", "go"],
      "items": [
        { "id": "gather", "name": "Gather", "color": "#5d8a3e", "summary": "We gather to worship by attending one service and serving during one — Attend One, Serve One.", "url": "https://nvf.life/serve" },
        { "id": "give", "name": "Give", "color": "#b3852b", "summary": "Generosity keeps the mission multiplying — and it is first a heart issue.", "url": "https://nvf.life/give" },
        { "id": "group", "name": "Group", "color": "#347b6f", "summary": "God designed the Christian life to thrive as believers share life together.", "url": "https://nvf.life/life-groups" },
        { "id": "go", "name": "Go", "color": "#ae5230", "summary": "Multiplication spreads from our neighborhoods to the nations.", "url": "https://nvf.life/one" }
      ]
    },
    "clay_stages": {
      "description": "Clay in the Potter's Hands — our picture of personal spiritual growth, from Isaiah 64:8. Five ordered stages, each multiplying something.",
      "items": [
        { "id": "found",   "name": "Found",   "color": "#5d8a3e", "stage": "Community to Crowd",        "multiplies": "magnifiers of His name" },
        { "id": "formed",  "name": "Formed",  "color": "#4f7e54", "stage": "Crowd to Changed",          "multiplies": "models of His character" },
        { "id": "fired",   "name": "Fired",   "color": "#347b6f", "stage": "Changed to Committed",      "multiplies": "members of His family" },
        { "id": "filled",  "name": "Filled",  "color": "#b3852b", "stage": "Committed to Commissioned", "multiplies": "ministers of His grace" },
        { "id": "flowing", "name": "Flowing", "color": "#ae5230", "stage": "Commissioned to Carrying",  "multiplies": "messengers of His love" }
      ]
    }
  },

  "color_system": {
    "palette": {
      "primary": {
        "name": "Brand Leaf Green",
        "hex": "#5f9a32",
        "rgb": "95, 154, 50",
        "text_on": "#221f1b",
        "usage": "Primary brand green on light backgrounds. This is the canonical application-palette green — used for layouts, backgrounds, accents, CSS tokens, website styling, and newly created branded materials. It is deliberately distinct from the green(s) embedded in official logo artwork (see logos.lockups colors and the note below) — the two do not need to match exactly. Rules, large kickers, accents, buttons, icon fills. As a text color it only reaches WCAG AA at large-text sizes (see color_system.accessibility) — for small text and labels use Green Deep instead, and when this green is a solid background behind text, set the text in Ink (#221f1b), not white.",
        "tones": [
          { "name": "Green Deep",   "hex": "#42701f", "usage": "Small text, links, and labels on light backgrounds where #5f9a32 lacks contrast. Passes WCAG AA for normal text on Paper." },
          { "name": "Green Bright", "hex": "#74ca33", "usage": "Accent green for DARK backgrounds only. Canonical application-palette green for dark backgrounds — see the note above about logo artwork carrying its own, separate green. Never on paper — fails contrast badly at any text size on light backgrounds." }
        ]
      },
      "secondary": {
        "name": "Olive",
        "hex": "#4a5d2f",
        "rgb": "74, 93, 47",
        "text_on": "#ffffff",
        "usage": "Muted supporting green. Scripture rules, eyebrow labels, the road motif.",
        "tones": [
          { "name": "Olive Deep", "hex": "#37461f", "usage": "Dark green panels and contrast columns with white text." }
        ]
      },
      "neutral_dark": {
        "name": "Charcoal",
        "hex": "#24201d",
        "rgb": "36, 32, 29",
        "text_on": "#faf7f1",
        "usage": "Dark backgrounds — covers, section dividers, action slides. Never pure black.",
        "tones": [
          { "name": "Charcoal Lift", "hex": "#2d2823", "usage": "Raised surfaces on dark backgrounds." }
        ]
      },
      "neutral_light": {
        "name": "Paper",
        "hex": "#faf7f1",
        "rgb": "250, 247, 241",
        "text_on": "#221f1b",
        "usage": "Primary light background. Warm off-white — never pure white.",
        "tones": [
          { "name": "Paper Card", "hex": "#f1ece2", "usage": "Cards, wells, and inset panels on light backgrounds." },
          { "name": "Paper Deep", "hex": "#e9e2d5", "usage": "Third-level surface for layering." }
        ]
      }
    },

    "text": {
      "ink":      { "hex": "#221f1b", "usage": "Primary body and heading text on light backgrounds." },
      "ink_soft": { "hex": "#4a443d", "usage": "Secondary and supporting body text." },
      "on_dark":  { "hex": "#d9d2c6", "usage": "Body text on charcoal backgrounds." },
      "metadata":         { "hex": "#6d675b", "usage": "Small uppercase labels, tags, and swatch metadata on light backgrounds (Paper, Paper Card, or white) where ink_soft reads as too heavy. Passes WCAG AA for normal text against all three." },
      "metadata_on_dark": { "hex": "#9a8f81", "usage": "Small uppercase labels and metadata on Charcoal backgrounds where on_dark reads as too heavy. Passes WCAG AA for normal text against Charcoal." }
    },

    "lines": {
      "hairline":      { "hex": "#e1dacc", "usage": "Dividers and card borders on light backgrounds." },
      "hairline_dark": { "hex": "#433d36", "usage": "Dividers on dark backgrounds." }
    },

    "accents": {
      "description": "Four earthy, green-anchored accent colors used to differentiate categories and sections. They happen to color-code the On-Ramps framework (frameworks.on_ramps) in Gather/Give/Group/Go order, but should be referred to by color name — Moss, Teal, Ochre, Terracotta — everywhere outside that specific framework. Never introduce a fifth.",
      "moss":       { "name": "Moss Green", "hex": "#5d8a3e", "text_on": null, "usage": "As a solid background, neither white nor Ink passes WCAG AA for normal-size text (both land around 4.0:1). Safe for large text (18pt+/14pt bold+, roughly 24px+), for the swatch name treatment, or as a border, rule, icon, or other decorative/non-text element. For normal-size text, use Moss Deep instead — either as the text color on a light background, or set small text inside a light chip rather than directly on the Moss fill.", "tones": [ { "name": "Moss Deep", "hex": "#4a6e31", "usage": "Small text, labels, and links on light backgrounds where Moss (#5d8a3e) lacks contrast. Passes WCAG AA for normal text on Paper." } ] },
      "teal":       { "name": "Muted Teal", "hex": "#347b6f", "text_on": "#ffffff", "usage": "Passes WCAG AA for normal text both as a background with white text and as a text color on Paper." },
      "ochre":      { "name": "Ochre",      "hex": "#b3852b", "text_on": "#221f1b", "usage": "As a solid background, Ink passes WCAG AA for normal text; white does not (3.3:1) and is large-text only. As a text color on light backgrounds, Ochre itself fails normal-text contrast — use Ochre Deep instead.", "tones": [ { "name": "Ochre Deep", "hex": "#7d5d1e", "usage": "Small text, labels, and links on light backgrounds where Ochre (#b3852b) lacks contrast. Passes WCAG AA for normal text on Paper." } ] },
      "terracotta": { "name": "Terracotta", "hex": "#ae5230", "text_on": "#ffffff", "usage": "Passes WCAG AA for normal text both as a background with white text and as a text color on Paper." }
    },

    "interactive": {
      "description": "For on-screen product UI only — logged-in app-like screens, buttons, links, hover states, and small badges on very dark backgrounds, as used on my.nvf.life. Print, booklets, announcement graphics, and other static compositions should keep using the palette and accents above, not these. This tier exists because tiny interactive elements need more lightness and chroma than a printed page does to stay legible and tappable against a near-black screen.",
      "surface_dark": { "name": "UI Charcoal",             "hex": "#1b1815", "usage": "Primary dark background for app-like screens — a touch darker than Charcoal for extra contrast against the brighter interactive greens below." },
      "link":         { "name": "Interactive Green",       "hex": "#93d86a", "text_on": "#15240a", "usage": "Links and secondary interactive text on dark UI." },
      "button":       { "name": "Interactive Green, Bold", "hex": "#7fd142", "text_on": "#15240a", "usage": "Primary buttons and other high-emphasis controls on dark UI." },
      "alert":        { "name": "Alert Red",                "hex": "#a94442", "text_on": "#ffffff", "usage": "Errors, destructive actions, and required-field warnings. The only red in the system — reserve it for real alerts, never decoration." },